标题,来源,时间,问题,回答
咨询,fy*** (山西),2013-06-28 13:35,您好，我是山西理科考生，高考成绩高出一本线45分，上贵校的威海校区希望大不大，能否上较好的专业,请咨询06315687013
报考咨询,13*** (云南),2013-06-28 13:31,老师您好，我是云南考生，今年高出一本线30多分能否报考威海校区？,具体请咨询06315687013
有机会吗,fe***o (河南),2013-06-28 13:20,531河南理科生有机会来贵校学习吗,我校今年在河南预估分数线为605分左右。
这样的选择能确保满足之一吗？,95*** (江苏),2013-06-28 13:10,老师你好，我是江苏理科考生排名2582，377A+A填报贵校专业的前三个志愿1建筑2土木3电气控制及自动化。能不能确保3选1，不会到第四专业志愿。谢谢！,我校在贵省的政策是：全省前3000名的考生，满足前三个专业志愿之一。
咨询,ga***9 (山西),2013-06-28 13:07,请问老师，如果在哈尔滨工业大学威海就读，可以考哈尔滨工业大学（哈尔滨）的考研究生吗？同一学科哈尔滨工业大学威海和哈尔滨工业大学（哈尔滨）录取分数有什么差别？,可以。录取分数您可去网上查询，本部录取分数高于威海录取分数。
咨询,mx*** (山东),2013-06-28 13:04,659省1632建筑OK不？土木呢,你好，被学校录取希望大，但是这些专业有难度。
录取分数,qs*** (广东),2013-06-28 12:58,请问老师，威海校区在广东提档线估计多少？,600分左右吧
特长生,ty*** (山西),2013-06-28 12:56,请问特长生是否可选本硕连读专业？,你好，可以报考。
山西理科,sc*** (山西),2013-06-28 12:54,您好，我今年578分，全省排名1500，报考您校有希望吗？选择专业的空间大吗？,你好，录取希望很大的，能选到心仪专业的可能比较大的。
咨询,li*** (广东),2013-06-28 12:51,您好！请问今年贵校在广东省是否招收食品科学与工程学生？招多少？谢谢！,暂不招收的。
广东理科生,sa***501 (广东),2013-06-28 12:50,1、老师您好，我是广东省的考生，今年我的高考成绩615分，超出一本线41分，请问报贵校录取几率如何？2、报考贵校的土建类、建筑类、环境科学类希望大吗？您有何建议？3、我担心选择不了好的专业，想选服从调剂，一般这种分数进去服从调剂会被调到哪些专业呢？,你好，录取还是有希望的，报考土建类、建筑类难度大些，环境科学类希望还是有的，服从调剂优先调剂与所选的相关专业的。
山西口试,sx*** (山西),2013-06-28 12:48,贵校提前批中理工类俄语-飞行器设计与工程需要口试吗？,不需要的。
河南理科生,15***96 (河南),2013-06-28 12:42,老师，您好！请问贵校提前批2012年录取的河南理科生最低分？？？非常感谢！！！,http://zsb.hit.edu.cn/studentnews/user/score.asp?kprovince=河南&kyear=2012
河南理科,00*** (河南),2013-06-28 12:07,老师您好！我是河南理科一名考生，585分，超出一本线80分，排名5000，报考贵校录取的希望大吗？不是被调剂录取的可能大吗？,你好，希望不是很大的。
关于专业调剂的问题,81*** (安徽),2013-06-28 12:01,请问如果我所填6个专业均未被录取，服从专业调剂，那么是在所有学生（最后一名被提档学生）均录取完后统一进行专业调剂，还是在当前阶段就进行专业调剂。（安徽平行志愿）,均录取完后统一进行专业调剂。
山东文科,sq***1496 (山东),2013-06-28 11:57,老师您好！我是山东文科考生，602分，全省排名3971，高出一本线32分，想报考贵校，能被录取吗？填报专业您有什么建议？,你好，希望还是很大的。
河南理科,hn***nhui (湖南),2013-06-28 11:49,老师您好，我是河南理科一考生，考了595，全省3231名，超一本线90分，请问报考贵校有希望吗？感激不尽！,你好，今年预估线在605分左右，请参考。
山东理科,cy*** (山东),2013-06-28 11:44,2013山东考生637分报考贵校有多大把握？在山东排名多少希望较大。,你好，今年山东预估线在650分左右，排名3000名以内差不多
选专业,lg*** (山西),2013-06-28 11:41,我考了580，请问敢报贵校的好专业吗,你好，建议慎重填报热门专业的。
河南理科,10***5 (河南),2013-06-28 11:39,老师您好，我是河南一考生，若平行志愿第二个学校报贵校对录取有无影响,无影响。
河南理科,10***5 (河南),2013-06-28 11:37,老师您好，我是河南理科考生，610分，1500~1600名，报贵校好专业有多大把握,录取考生中，高考成绩排名在全省前1700名的考生，满足专业志愿（考生须填满专业志愿），即保证考生录取到所报专业志愿当中的一个。
河南理科报考咨询,zh***therine (河南),2013-06-28 11:35,老师，您好！我是河南理科应届生，高考589分，超出一本线84分，报考贵校有希望吗？如果服从调剂呢？谢谢老师！,你好，今年的预估线在605分左右，不过这只是个估计，感觉还是有些希望的
咨询,xr*** (山西),2013-06-28 11:20,山西考生，579分，报考贵校选择专业有材料类或机械类有多大希望。谢谢！,我校今年在山西预估分数为565分左右。材料类和机械类很有希望。
咨询....求解,15***68 (北京),2013-06-28 11:18,老师好！我是山西的一考生.我高考成绩577.全省排名1579.能被贵校录取吗？如果能您能不能给我的专业提点意见吗？,我校今年在山西预估分数分数为565分左右。基本可以录取。专业可选择一些分数中等的专业。具体可参考：http://zsb.hit.edu.cn/studentnews/user/score.asp?kprovince=%E5%B1%B1%E8%A5%BF
广东理科生,li*** (广东),2013-06-28 11:08,您好，我今年考了613分，高出一本线39分，10586名，想要报考贵校化学工程与工艺，化学类，环境科学，材料科学与工程，有希望被贵校录取吗？,我校今年在广东省预估分数线为615分左右。
河南,83*** (河南),2013-06-28 11:07,老师，河南文科至少要多少分呢？,河南文科预估为560分左右
河南录取,83*** (河南),2013-06-28 11:06,河南，文科，高一本线37，排名2343，有望上贵校吗？文科有哪些好点的专业呢？我可以上吗？谢谢老师。,我校在河南文科预估为560分左右。有希望。文科可以学管理类的专业。
咨询,13***35 (云南),2013-06-28 11:02,老师好：我是云南考生578分，排名4927，能否报电气工程专项生?,我校今年在遇难预估在610分左右。
河南理科,zb*** (河南),2013-06-28 10:58,老师好，我是河南理科考生，612分，超一本线102分，省内排名1429，请问报考贵校且专业服从调剂，能否被录取？请问贵校的重点专业是哪些？请告诉我贵校负责河南信阳招生老师的电话。,我校在河南今年预估分数为605分左右。保证录取到所报专业之一。河南招生电话：15146000025、15146000027.我校重点专业：http://www.hit.edu.cn/research/key_subject.htm
广东理科生,li*** (广东),2013-06-28 10:56,您好，我今年考了613分，高出一本线39分，10586名，想要报考贵校化学系，化学工程与工艺系，环境科学系，材料科学与工程系，有希望被贵校录取吗？,你好，还是有希望的。
录取,95*** (山东),2013-06-28 10:44,老师，山东理科，658分，排名1770，如第一顺序A填报贵校，能保证6个志愿录取一个吗,前1000名的考生填满志愿的情况下，可以保证的。
专业,01*** (黑龙江),2013-06-28 10:43,我是黑龙江理科考生，636分，请老师帮忙看看我选的专业是否合理，工程力学，自动化，电子信息科学与技术，信息安全，电磁场与无线技术，数学类。如果服从调剂是否会被调剂到软件工程专业？,你好，专业这个把你喜欢的放在最前面，此喜欢的放在第二位，以此类推即可，服从调剂的话会优先安排和你选的相关专业的。软件工程可能性应该不是很大。
咨询,ca*** (河南),2013-06-28 10:43,老师您好，我想能不能咨询一下贵校前往漯河高中咨询会相关老师的联系方式，谢谢,你好，你可以电话咨询15146000025、15146000027
山西考生,18***44 (北京),2013-06-28 10:41,贵校有哪9个国家一级重点学科？谢谢,http://www.hit.edu.cn/about/statistics/first_key_subject.htm
山西考生,18***44 (北京),2013-06-28 10:37,贵校有哪些好专业？请具体一些，谢谢,你好，我校工科专业比较好，具体可以看http://zsb.hit.edu.cn/subindex/intro/academyintro.asp
山西 理科,31*** (山西),2013-06-28 10:35,您好，我是山西理科考生今年580，高出一本线87分。排名1300左右，有可能进入贵校土木工程，能源与动力工程或者飞行器相关的专业吗？,我校今年在山西预估565分左右。土木和能源可以报，飞行器相关的只能报飞行器环境
提前批,41*** (河南),2013-06-28 10:28,请问老师提前批学生入学后可否申请转专业,不能
山西考生,18***44 (北京),2013-06-28 10:26,贵校有哪些好专业？,我校有9个国家一级重点学科，具体可参考：http://www.hit.edu.cn/research/key_subject.htm
福建考生,li***ansheng (福建),2013-06-28 10:23,你好，我是今年的福建考生，572分，录取分数线为501，排名为9205，请问去贵校的希望大吗？能去什么好的专业吗？,我校今年在福建预估分数为605分左右。
专业选择问题,xx***6 (安徽),2013-06-28 10:23,你好！我是安徽理工类考生，总分595，排名2154，报考贵校有没有希望进入航天学院中的专业。,我校今年在安徽省预估录取分数在585分以上。进航天学院只能学边缘专业
山西理科,31*** (山西),2013-06-28 10:20,我是山西理科考生今年580排名1300左右，有可能进入贵校土木，能源与动力工程，电气及其自动化或者飞行器相关专业吗？,你好。录取希望很大的，进这些专业希望也很大。
请问贵校在湖北有二本招生计划吗,ex*** (湖北),2013-06-28 10:16,电气工程及其自动化专业,没有。
福建理科,yz*** (福建),2013-06-28 09:59,老师，您好！我是福建省理科考生，高考分数593，高出本一线92分，省内排名4889名，想报考贵校，录取希望大不大？谢谢！,你好，我们今年预估线在605分左右，不过这个只是个估计值，还是有些希望的。
调专业,cl***22 (山东),2013-06-28 09:56,我是山东文科考生，想报考贵校，请问入学后可以调专业吗？如可以入学多长时间可以转，转专业的条件是什么？,你好，入学一年以后，学习成绩优秀可以申请换专业。
山西考生,18***44 (北京),2013-06-28 09:56,576分可以上贵校的哪些专业？,你好，你可以选择我校的工科专业，这些专业都是比较好的，具体分数可参考http://zsb.hit.edu.cn/studentnews/user/score.asp?kprovince=山西
山西理科,km*** (山西),2013-06-28 09:51,老师您好，我是山西理科考生，分数543，排名6400+，超出一本线50分，报考贵校威海分校被录取希望如何？谢谢。,我校在山西今年预估分数线为565分左右。
陕西理科考生,gu***guojiang (陕西),2013-06-28 09:48,老师您好！陕西理科位次809，能报贵校哪些专业？可否填报机械设计制造及其自动化？谢谢,按照您的全省排名，我校的政策是全省排名在前1000名的考生，满足第一专业志愿（建筑学除外）。所有专业都可以报考。
广西少数民族预科,bu*** (广西),2013-06-28 09:45,1.请问贵校2012年在广西招收的少数民族预科（理科）录取分数线最高和最低为多少？2.广西考生2013年分数531含加分一本线510报考贵校少数民族预科班希望大不大？,2012年预科最高最低分数：607、566.预科班不能加民族分，且一般要高出一本线30分以上。
咨询,zq*** (山西),2013-06-28 09:41,哈尔滨工业大学威海校区和哈尔滨工业大学时一个学校吗？毕业证怎么发？,威海我校的一个分校区，隶属于我校。毕业证一样。
山西考生,18***44 (北京),2013-06-28 09:38,576分是否可以上贵校的王牌专业,我们学校在山西今年预估分数为565分左右。上热门专业希望不大。
您好陕西理科614分 排名2413 能否报考贵校,64*** (陕西),2013-06-28 09:32,您好陕西理科614分排名2413能否报考贵校？,我校今年在陕西省预估分数为605分左右。您的成绩基本没有问题。
关于报考,wa***25 (山东),2013-06-28 09:27,山东考生，630分，7812名，报考贵校电气或土木专业能否被录取？贵校转专业政策如何？,我校今年在山东省预估分数线在650分左右。
江苏理科,xw***88 (江苏),2013-06-28 09:26,老师您好：369AA报考贵校有希望吗？,我校今年在江苏省预估录取分数线在368分左右。
专业,xi*** (江西),2013-06-28 09:26,请问转专业有什么要求,大一一年的学习成绩在全专业排名在前10%即可。
录取,22***0 (河南),2013-06-28 09:22,在河南，排名前1000的理科考生可以满足几个专业之一等等这些具体是怎样的,在河南全省排名在前1700名的考生，满足专业志愿（需填满志愿）；在全省前1000名的考生，满足前三个专业志愿之一；前800名的考生，满足第一专业志愿。
报考,ga***9 (山西),2013-06-28 09:21,我是山西理科考生，554分，高出一本线61分，排名4248，想报考哈尔滨工业大学（威海），把握大吗？另外贵校专业有极差吗？,请咨询威海校区：06315687013.我校专业无级差。
报考,xi*** (江西),2013-06-28 09:21,老师你好，我是江西考生，总分586.请问能上贵校吗,我校在江西今年预估分数线在590分左右
分数咨询,82*** (山西),2013-06-28 09:08,老师您好我是山西文科考生超一本线9分有机会上您校吗,我校今年在山西文科预估分数为535分左右。
辽宁理科,66*** (黑龙江),2013-06-28 09:02,老师您好，我是辽宁理科考生，成绩633，排名2500，有希望上贵校吗？谢谢！,有希望，今年在辽宁省预估是超出重本线90分左右。
山东理科,ri*** (山东),2013-06-28 09:02,你好，我是山东的理科考生，高考成绩为658，请问报考贵校被录取有几分把握？能选到那些专业？谢谢。另外：贵校哪些专业需要参加外语口试？谢谢。,我校今年在山东省预估录取分数在650分左右。很有希望报考。选一些中等分数的专业即可。无专业加试外语口语。专业分数课参照：http://zsb.hit.edu.cn/studentnews/user/score.asp?kprovince=%E5%B1%B1%E4%B8%9C
矫正视力4.8，刚好等于400度，报飞行器制造是否受限,yw*** (广东),2013-06-27 16:59,矫正视力4.8，刚好等于400度，报贵校飞行器制造专业是否受限,原则上没有，请咨询院系045186413262
山东理科国防生,mo***u (山东),2013-06-27 16:58,老师你好，我是山东理科考生，高考分数超过一本线49分，位次21000名左右。请问：能否考上贵校的国防生呢？,根据历年我校在山东省国防生招生录取分数，一般超出重本线40分以上可以报考，你的分数希望很大
专业,cs*** (安徽),2013-06-27 16:57,我是安徽考生，605分，1186名，能上贵校什么专业。,今年理科预估分数585以上，很有希望。专业请看http://zsb.hit.edu.cn/studentnews/user/score.asp?kprovince=%E5%AE%89%E5%BE%BD
云南理科考生,28***6 (云南),2013-06-27 16:53,老师，我是云南理科考生，619分，全省1424名（54人与我同分数），报考贵校电气工程及其自动化﹑计算机科学与技术﹑电子信息技术能有优势吗,云南今年的预估分数是610左右，具体专业历年分数请看http://zsb.hit.edu.cn/studentnews/user/score.asp
少数民族预科班,00*** (广西),2013-06-27 16:25,老师您好，我是2013届广西考生，分数475，排名36271，请问填报贵校预科班是否有希望？,请参考http://zsb.hit.edu.cn/subindex/studentnews/yuke.asp
请问老师,68*** (云南),2013-06-27 16:25,贵校在云南招收的专业里有军工专业吗，,您是想问国防生还是贫困专项吗？这个具体以省招办报考指南公布的为准。
关于招生咨询老师的承诺,zp*** (陕西),2013-06-27 16:22,陕西的考生，排名在省500名以内，在咨询会上，咨询老师说可以进贵校的英才学院，不知道这个场合的口头承诺是否有效？,有效。是本硕连读。但是报考时候，需要报考英才学院所包含的专业才可以。具体请看http://zsb.hit.edu.cn/subindex/studentnews/yingcaiban.asp
咨询,pa*** (福建),2013-06-27 16:04,我是福建理科考生，今年考了611，排名2266，希望报电气工程及其自动化，希望大吗,福建605分左右，专业请参考http://zsb.hit.edu.cn/studentnews/user/score.asp?kprovince=%E7%A6%8F%E5%BB%BA
山东理科,sa*** (山东),2013-06-27 15:59,少数民族加分后649，排名3028，能否报贵校？适合什么专业?,山东今年预估分650分左右
山西考生,20*** (山西),2013-06-27 15:57,我是山西考生，575，是否有希望上贵校,今年山西预估分数565分左右，有希望
报考,22***2 (山西),2013-06-27 15:55,您好，山西文科生报考贵校估计多少分才有可能被录取，谢谢！,535分左右
理综成绩对选择专业有没有影响？,xx***6 (安徽),2013-06-27 15:55,我是安徽考生，总分595，理综237，请问理综成绩会不会影响到专业的选择？,看总分，不影响
报考咨询,33*** (江苏),2013-06-27 15:54,老师您好，请问：1）哈尔滨工业大学与哈尔滨工业大学（威海）在行政、教学上有什么区别？2）贵校在江苏地区的预估分数线是多少？3）我高考成绩363+A+A。在江苏省名次为9235名，报考希望大不大？谢谢！,1）各自独立负责。威海校区有自己的独立管理和教学体系。2）江苏主校区是368左右。请斟酌报考
报考咨询,xx***6 (安徽),2013-06-27 15:39,请问报考贵校对女生有没有什么特殊的要求或限制？,除了国防生，普通学生，专业上没有性别差别
专业咨询,li***n509 (山东),2013-06-27 15:38,老师您好！我是山东省理科考生，成绩658，排名1700。我想学习工科专业，如【自动化】【机械设计制造及其自动化】【材料科学与工程】或【能源与动力工程】，请问有希望吗？,山东考生提档预估分数650左右。专业清参考http://zsb.hit.edu.cn/studentnews/user/score.asp?kprovince=%E5%B1%B1%E4%B8%9C
辽宁理科640分能录取吗？,ge***55 (辽宁),2013-06-27 15:17,如题,辽宁预估超90分左右，有希望
报考,18***7 (山东),2013-06-27 15:10,老师，今年考625分，报考哈尔滨工业大学被录取的希望大不大？,山东理科今年预估650左右，希望不大
自主招生,a5*** (河北),2013-06-27 15:07,老师，我们河北报考时有自主招生批次，我已填报哈工大，请问我还用不用在本一批次第一志愿A填报哈工大？我今年考了621分,请致电河北招生办，是否需要，各个省的要求不同，比如黑龙江省是需要的。河北省请咨询河北省招生办
辽宁考生,ba***i (辽宁),2013-06-27 15:05,老师：您好，我是贵校自主招生通过的考生，高考分、加分共计638分，请问能达到录取分数线吗？,辽宁省预估超重点线90分左右。自主招生优惠政策请以协议书为准
广东理科613分排名10586有希望吗,li*** (广东),2013-06-27 15:05,广东理科613分高出一本线39分排名10586有希望被贵校录取吗？,广东今年预估分是615左右
zx,sx*** (陕西),2013-06-27 15:03,陕西理科考生今年考试成绩为531超出一本线46分排名21491请问如果报考贵校录取的可能性有多大,陕西理工预估605分左右
辅修,po*** (黑龙江),2013-06-27 14:50,辅修期间，对第一主学科的成绩要求是什么？若有几次未达到是否会停止辅修？,这个请咨询相关院系，各个院系有自己不同的要求。院系电话请在工大主页找。或者致电工大总台86412114查询。
咨询,pa*** (福建),2013-06-27 14:33,我是福建理工考生，今年考了611，排名2266，有希望被录取吗？,很有希望，专业分数请查看http://zsb.hit.edu.cn/studentnews/user/score.asp?kprovince=%E7%A6%8F%E5%BB%BA
报考咨询,59*** (黑龙江),2013-06-27 14:30,我是黑龙江考生，高重本线65分，报考威海校区，选择冷门专业等，服从专业调剂，1.请问，录取可能大吗？2.威海校区也是无级差不退档么,请致电威海校区06315687013
咨询,87*** (山东),2013-06-27 14:30,请问贵校有无专业极差？,没有
咨询,ee*** (广东),2013-06-27 14:27,请问贵校本部和威海校区在广东省今年预估分数线是多少？,本部预估615左右。威海请致电威海招生办06315687013
录取,18***23 (山西),2013-06-27 14:23,您好！老师，我是山西考生，如果服从调剂，贵校是不就不退档了。,如果您被提档了，并且服从专业调剂，哈工大不会退档
报考,99*** (黑龙江),2013-06-27 14:21,你好我是黑龙江理科考生，607分上工大有戏么？？？实话实说,黑龙江今年预估分数线620左右
志愿,xx***aka (广东),2013-06-27 13:58,请问广东7800理科考生620我能上经济系吗？,广东今年预估理工类是615左右，具体专业请看历年专业分数线。
报考咨询,wu***un (北京),2013-06-27 13:57,我是安徽考生今年高考成绩588排名2895能报贵校吗能上什么专业,安徽今年预估线是585分一下，有希望
理科提前批,wa***ng1992 (河南),2013-06-27 13:49,河南508有希望吗？？,理工类预估分605左右希望不大
录取,ch***3 (山西),2013-06-27 13:38,您好，我是山西考生，理工，高一本20分，被贵校提前批录取机会有多大？,山西今年预估565分左右
专业,wo***34abc (河北),2013-06-27 13:26,河北提前批饿语-飞行器在那学院上学毕业后干什么,俄语飞行器专业，俄语是一学位，飞行器是第二学位，属于辅修学位。如果要拿飞行器学位，需要5年，只拿俄语第一学位，是四年。具体请致电哈工大俄语系咨询。0451-864114520
河南理科,13***89 (河南),2013-06-27 13:14,河南理科超线多少可报贵校？谢谢！,605分左右
关于少数民族预科班录取问题,du*** (吉林),2013-06-27 13:14,我是吉林理科考生，请问贵校在吉林省招生的少数民族预科班计划，实际录取时，有不同少数民族比例限制吗？比如招生计划为10人，其中录取朝鲜族3人，满族2人，回族4人，蒙古族1人。,没有
报考咨询,jh*** (浙江),2013-06-27 13:13,老师您好，我是浙江理科考生，686分，4255名，请问报考贵校专业选择空间大不大？谢谢。,浙江今年预估分680分左右。
考研,92*** (山东),2013-06-27 12:56,老师您好，如果在威海校区读完本科以后考本校研究生有没有什么有利条件？,如果成绩好，可以直接报送到哈尔滨本部。
河南理科594，希望报考贵校国防生,zx*** (河南),2013-06-27 12:52,您好。我是河南理科考生，今年分数594.请问报考贵校提前批国防生是否希望比较大？,河南预估605分左右
河北文科,qi***9 (河北),2013-06-27 12:46,老师您好，我是河北文科考生，考分598，超出一本线37分，请问报考贵校有希望吗？贵校预估的分数及名次是多少，谢谢。,585分左右
专业,qi***9 (河北),2013-06-27 12:45,老师您好，请问新生可以跨学院（文科或文理兼收）重新选择专业吗？新生在什么校区上课，住宿情况怎么样？谢谢,文科不可以转到工科。在哈尔滨校区上课。大一6人间，大二4人间。
河南理科,10***5 (河南),2013-06-27 12:41,老师您好，我是河南一考生，610分，1500~1600名，报考贵校优势专业有多大把握,河南预估605分左右，有希望。专业分数请参考招生网上历年专业录取分数线
咨询,sh***ibi (黑龙江),2013-06-27 12:40,我是黑龙江理科考生，高出重本线66分，能入读贵校吗,黑龙江预估620分左右
贵校在上海最低分数大概是多少？,zh*** (上海),2013-06-27 12:17,老师您好：很想知道今天贵校在上海的录取最低分数是大概多少分？,您好，还没有统计
少数民族预科班,dh*** (内蒙古),2013-06-27 12:01,我是内蒙今年的考生，高考549分，超出一本线67分，我想报贵校的预科班，有希望吗？往届预科班录取都多少分呢？,请参考http://zsb.hit.edu.cn/subindex/studentnews/yuke.asp
报考咨询,71*** (四川),2013-06-27 11:59,老师您好，我是四川理科考生，620分，报考遥感科学与技术专业有希望吗？谢谢.,您好，今年四川提档预估分是620左右，具体专页请参考招生主页历年录取分数线
陕西文科,18***26 (陕西),2013-06-27 11:55,贵校文科实力怎么样,还可以
想问,po*** (黑龙江),2013-06-27 11:51,老师您好，想问一下，（1）辅修期间，对第一主学科的成绩有要求吗？（2）所发学位证上有第一第二学位标注吗？有不同吗？（3）就业时，第二学位只做参考是吗？那若考了辅修的研，性质会有变化吗？望赐教！谢谢,（1）有（2）有标注（3）就业看用人单位的需求。考研的时候，只要求是本科毕业，报考时，专业无限制
