标题,来源,时间,问题,回答
录取,13***16 (山西),2018-07-02 16:40,老师好山西文科591排名1174—1223可以报吗,我们在山西文史的参考分数是586左右，你的成绩可以报
安徽理科,dr*** (安徽),2016-06-14 15:05,老师您好：请问英才学院不同省份怎么选拔是否按照省级排名还是入学再考试？,学校通过“英才学院”模式，按照录取考生高考分数，选拔不超过200名优秀新生进入英才学院。按照各省来衡量考生在全省的排名，入学前选拔结束，报到时候直接进入英才学院。
安徽理科,dr*** (安徽),2016-06-14 14:58,贵校本部计划招生4300人其中深圳校区400人是如何被选取就读的,你好，填报志愿时候深圳的专业代码与校本部的代码不同，以此来区分你所报的校区。
黑龙江全省6000可以报分校吗,sa***13 (黑龙江),2016-06-14 10:58,平时成绩全省6500-7500服从调剂可以报分校吗,你好，今年具体的录取排名暂时还不能预测，请你先参考往年的录取分数。
我是安徽今年理科考生，预估600分，报考贵校有希望吗？,lh*** (安徽),2016-06-14 10:23,我是安徽今年理科考生，预估600分，报考贵校有希望吗？,你好，请你参考往年对录取分数线http://zsb.hit.edu.cn/studentnews/user/score.asp?kprovince=%E5%AE%89%E5%BE%BD
报考贵校少数民族预科考生,13***18 (四川),2018-07-02 09:38,老师好！我是2018高考四川苗族理科考生，我i的分数是589分（i省排名是36082位），我报考贵校的少数民族预科班，请问是否有希望录取,根据前两年的情况，是有很大的希望的。但是不能保证。
志愿填报,15***23 (河南),2018-07-02 09:18,如果报了哈工大高校专项，本科一批志愿还需要填写贵校吗？,可填可不填，没有什么影响的。
山东考生,18***08 (山东),2018-07-01 16:41,高考649省3248能上贵校软件工程吗？,同学你好，今年工大在山东预估分数在650左右，排名3199
录取咨询,18***67 (河南),2018-07-01 14:51,河南理科653能上什么专业,同学你好，你有希望报考工大，具体专业还要你自己选择
录取咨询,15***88 (山东),2018-07-01 12:28,山东理科609分，位次15435，报考贵校有希望吗？,同学你好，希望不大，今年工大本部预估650左右可报，威海620左右可报
关于志愿填报的问题,74***@qq.com (广东),2018-06-30 16:31,问下老师广东考生606分省排名7224名想报考校本部机电类的专业有希望录取吗？服从专业调剂有退档风险吗？,去年本部机械类在广东的分数线是587。服从调剂不退档
哈工大深圳校区的一些问题,13***37 (广东),2018-06-29 16:55,我想问一下，贵校的招生宣传中说在深圳校区就读会在毕业证书注明就读校区，那么在深圳校区就读与在本部和威海校区就读毕业证的效力，所受的教育，以及将来考研就业上是否会得到差别对待呢？另外，本人618，全省4800名左右想去贵校的计算机科学或者机电类的专业是否有希望？最后，贵校的转专业政策具体是怎么样的？,你的成绩可以去威海校区，学习机电类还是有希望的，威海毕业证和本部的没区别。我们这里没有深圳校区的参考分数。大一总成绩排名专业前30%可以在大一结束后申请转专业，经过对方学院的面试后就能转专业了。
志愿填报,18***90 (青海),2018-06-29 16:03,麻烦问一下老师今年我492分在青海超过一本线89分能否进入贵校学习谢谢您,同学你好，今年我校在青海的预估分数是540分左右
关于深圳校区,18***53 (海南),2018-06-29 13:14,您好！请问贵校深圳校区是否承诺服从调剂进档不退，是否设有专业级差，对于哪些专业有单科要求？谢谢！,平行志愿投档录取对专业服从调剂不退档；没有专业级差；没有专业有单科要求
录取咨询,18***04 (新疆),2018-06-29 09:24,您好！新疆考生634分，725位次报考贵校有希望吗？,有希望录取，可以冲一冲
深圳校区,13***63 (湖南),2018-06-29 09:03,请问，贵校深圳校区2018年在湖南的预估提档分是多少,深圳校区没有具体的预估提分档，你可以参考本部的，本部对于湖南的预估提分挡是633
黑龙江文史570，排名869--904，是否有希望被录取？,15***23 (黑龙江),2018-06-28 14:05,经济管理实验班机会大吗？,今年我校黑龙江文史类参考分数是567分左右，你的分数有希望被录取。经济管理试验班去年的分数线是573
国家专项计划录取,13***05 (河南),2018-06-28 13:52,老师你好！理科625分，7000名左右，请问有多大把握被国家专项计划录取(校本部）？,去年河南国家专项理工类录取分数线是593，你的希望很大
新疆理科,15***22 (新疆),2018-06-28 13:38,老师您好：请问新疆理科590分，位次3027，报考贵校威海分校能否进档，如服从专业调剂，有没有被退档的风险？谢谢,"哈工大2016年，2017年在新疆录取分数分别是560,543分。您可以对比一下往年对应的排名。只要服从专业调剂不会退档"
录取咨询,13***94 (西藏),2018-06-28 13:38,18年汉族理工考生，612分全区151名。录取的可能性大吗？,西藏17年的汉族最低录取分数是428，你的分数很高，录取没问题
咨询威海校区,me***5@163.com (吉林),2018-06-28 12:45,请问今年威海校区在吉林的招生预估线多少，603分，排名5659，有希望吗？,今年威海校区在吉林的参考分数是600，你还是有希望的
高校专项,15***97 (江苏),2018-06-28 12:17,老师，您好，请问江苏372物理A+生物A高校专项能进自己挑的6个专业之一吗？,江苏理工在本部的参考分数是380，威海校区是372。江苏前4000名来我校能保证一定是六个志愿之一
高校专项,15***95 (河南),2018-06-28 12:02,河南考生，有高校专项资格，596分，18167名请问有希望报考哈工大没，我不知道高校专项优惠的分值,这个没有参考分数，按从高到低依次录取，名额是固定的。
高校专项,15***95 (河南),2018-06-28 12:01,河南考生，有高校专项资格，596分，18167名请问有希望报考哈工大没，我不知道高校专项优惠的分值,这个没有参考分数，按从高到低依次录取，名额是固定的。
北京考生有三问,lg***3.com (北京),2018-06-28 12:00,北京理科考分644，全市排名2916。有三问：一是贵校在京投放的专业是哪些？不填满6个，会被退档吗？二是压线填报贵校，有多大希望？三是入校后怎样才能转专业？谢谢老师！,1、查看你们北京市发放的高考志愿专业填报材料，里面有各个学校在北京的招生专业；2、服从调剂不会退档；3本部在北京参考分数线是645，你还是有希望的；4大一结束时可以转专业，条件是专业成绩排名前30%并通过对方学院的面试
新疆,13***65 (新疆),2018-06-28 11:39,570分线差100四千三的位次，能报威海分校么？,哈工大威海校区2017年理工类在新疆最低录取分数是543，一本线是437，供参考
志愿填报,xc***6.com (贵州),2018-06-28 11:38,老师：侄儿高考分数644分，含20分政策加分，想报考你校的计算机专业，不知合适不？,624+20=644，我校在贵州的参考分数线是630左右，所以录取没有问题，但是能否录取不一定，可以报一下，哈工大不退档的。
录取,15***31 (山东),2018-06-28 11:14,我是山东省一名理科生，高考分数为629，通过了贵校的农村专项计划，录取的机会大吗,您说的这个是高校专项计划，每个省是有名额的，从高分到低分依次录取，在结果出来之前我们无法预测录取分数线
高校专项,15***95 (河南),2018-06-28 11:05,河南考生，获得贵校高校专项资格，想咨询一下往年高校专项在河南录取的最低分,每位获得资格的考生优惠分值不同，您可以去教育部阳光高考平台查询公示信息
报考咨询,13***75 (山东),2018-06-28 10:54,老师您好，山东理科考生，626分，全省位次8717，有多大希望能被哈工大录取？谢谢老师！,本部在山东理工类的参考分数是650左右，不推荐你报考。威海校区在山东理工类的参考分数是620左右，你报威海校区还是比较有把握的
报考咨询,13***75 (山东),2018-06-28 10:53,老师您好，山东理科考生，626分，全省位次8717，有多大希望能被哈工大录取？谢谢老师！,威海校区在山东理工类的参考分数是620左右，你报威海校区还是比较有把握的
问个问题,13***71 (安徽),2018-06-28 10:53,安徽考生，637分，排名4115名，理科。能上贵校什么专业？,本部在安徽理工的参考分数是644，威海校区在安徽理工的参考分数是617左右，报威海校区还是能选择大多数专业的
录取,13***78 (湖南),2018-06-28 10:28,您好，今年湖南理科532报考贵校少数民族预科班可能性大吗？,去年湖南理科少数民族预科线是518分
报考咨询,15***30 (江西),2018-06-28 10:25,您好！我是江西理科考生，596分省排名9714.报考威海校区有希望吗？,今年我校威海校区在江西理工类的参考分数是581分左右，你还是很有希望的
关于威海校区问题,18***37 (山东),2018-06-28 10:07,请问威海的是分校还是校区？威海的与本部有什么区别吗？如果考研的话会不会有什么限制？,哈工大是一校三区，威海校区录取分数不同，毕业证上面没有区别。考研无限制
录取,18***55 (河南),2018-06-28 10:04,河南理科女650，是否可以被录取？如果可以，报什么专业比较好？,今年我校在河南理科的参考分数是645左右。女生不适合报土木建筑类。可以报考经管类
关于专业问题,13***73 (黑龙江),2018-06-28 09:44,老师您好，黑龙江理科，635排名1800左右。想咨询贵校的管理工程与科学跟工程管理专业是一样的吗？在招生计划中没有看到管理工程与科学这个专业。另外经管实验班中的信管专业普遍都说就业不太好，是吗？大数据专业学习的方向是什么？另外这个分数想学这些相关的专业把握大吗？谢谢老师。,工程管理是土木工程学院的；工商管理是经管学院；招生计划中没有管理工程与科学。，信管专业就业情况这个我们并不清楚，需要咨询对应的学院，大数据管理与应用是经济管理学院的，叫经济管理试验班。，2017年经济管理试验班理工类的分数线是616，哈工大理工类在黑龙江省的录取分数线是613。
录取问题,15***72 (河南),2018-06-28 09:39,老师，您好！我是河南考生，理科，612分，报威海校区把握性大吗？,我校威海校区在河南理工科的参考分数是614左右，可以参考一下
录取,15***48 (山东),2018-06-28 09:34,山东理科643分，冲一下工大本部有希望吗？,今年我校在山东理工的参考分数为650分左右，排名3200
录取机率,13***72 (山东),2018-06-28 09:12,老师，您好。我是山东考生。理科，621分，10757名。想报考贵校，请问录取机率如何？同时在威海校区机率如何？,同学你好，你的情况报考本部的话可能希望不大，但是威海校区还是很有希望
老师您好,13***67 (江苏),2018-06-28 09:12,"理科分数372,选科物理A,化学A+,位次11183,想报贵校威海校区,请问是否有希望?",我校威海校区理工科今年的参考分数就是372分，还是很有希望的
山东考生,13***09 (山东),2018-06-28 09:07,山东理科647分，位次3535。报考贵校有希望吗？,山东省今年推荐650分左右，排名3200左右可以考虑工大本部，你的情况可以选择冲一下工大
学校地区与专业关系,18***31 (贵州),2018-06-27 16:54,老师您好！我有意报考贵校的威海校区，但威海地区与主校在专业实力与学习条件方面是否有较大差异？,你好，两校区办学规格是一样的。师资有些许差别，但毕业后毕业证和学位证是一样的。
江苏理科,18***26 (江苏),2018-06-27 16:24,非常希望到贵校就读，江苏理科375双A+，排名在8200名左右，请问有希望吗？概率大吗？,你好，我校今年在江苏省的预计最低位次是5800左右，所以建议你可以报考我校威海校区试一下。
录取,15***61 (河南),2018-06-27 15:51,我在河南省排名3100，有希望考上吗？可以上哪些专业？数字媒体技术希望大不大？,今年我校在河南省的预估最低位次是3092名，所以你还是有希望的哦！
录取问题,18***37 (山东),2018-06-27 14:39,我是山东考生，今年分数620左右，有望报考威海校区吗？,你好，我校威海校区今年在山东的预估分为620分左右，所以你还是有很大的希望的。
威海校区,15***95 (云南),2018-06-27 14:17,请问威海校区专业之间有分数级差吗？,你好，没有的
关于深圳校区,18***87 (广西),2018-06-27 14:13,深圳校区进档服从调剂会退档吗还有每年能转专业的人数比例大概是多少深圳校区能辅修或者第二学位为计算机类专业吗谢谢老师,服从调剂不会被退档的。转专业每个人都有机会，只要通过欲转入专业的选拔即可。对辅修专业没有限制，学生根据自己的能力和精力进行自主申请。
关于院校内转专业 及辅修或者第二学位 和退档问题,18***87 (广西),2018-06-27 13:19,想咨询一下贵校服从调剂被提档后还会被退档吗转专业具体难度怎么样大概每年能有多少比例的学生能转专业，比较想转入计算机类或者软件工程，转入这两个专业难度怎么样？辅修的话辅修计算计算机类或者软件工程难度怎么样具体限制是什么样的比较感兴趣计算机类专业谢谢,服从调剂是不会被退档的。所有学生都有转专业的机会，转专业主要依据大一学年的学习成绩选拔。热门专业转入的难度相对较大。辅修功课工科专业会比较累。辅修没有具体限制。
威海校区,13***35 (河南),2018-06-27 13:03,河南理科617分，9681名，可以录取吗,今年我校在河南预估分为645分，你可以尝试一下我校威海校区。
人数,15***95 (云南),2018-06-27 12:15,今年贵校校本部在云南高校专项审核通过的人数是？,同学你好，可以在阳光高考平台上查看具体名单的。
请问贵州考生6890国家专项计划把握大吗？,15***94 (贵州),2018-06-27 12:13,威海校区,同学，你这个情况报考威海校区是有很大可能性的。
请问贵州省去年通过高校专项计划录取的最低分数以及排名是多少？,15***94 (贵州),2018-06-27 12:11,今年的6890名有希望吗？,建议尝试一下我校威海校区
哈尔滨工业大学深圳校区第二年可以转专业吗？,15***07 (贵州),2018-06-27 12:06,哈尔滨工业大学深圳校区第二年可以转专业吗？,咨询一下深圳校区招生办，电话：0755-26035891
报考哈工大（威海）咨询,13***12 (广东),2018-06-27 11:23,老师好：我是广东理科考生，今年577，省排位16696，哈工大（威海）15年、16年的这个排位是能上的，17年的排位就不够了，想咨询18年我这个排位能不能考上？,同学你好，根据今年的预估情况。你的分数是不够的，但你可以填第一志愿尝试一下，祝你好运。
黑龙江考生，成绩616，排名3826，报提前批有希望录取吗？,13***56 (黑龙江),2018-06-27 11:07,我黑龙江考生，请问成绩616，排名3826，报贵校的提前批有希望录取吗？,提前批小语种去年最低录取分587，请参照
咨询,13***93 (山东),2018-06-27 10:59,您好，山东文科，女生，607分，位次：3959，报考贵校的威海分校有把握吗？,有希望，威海今年预计606左右
威海校区,sq***@sina.com (河南),2018-06-27 10:50,河南理科603排名15057有机会被威海校区录取吗,机会可能比较小，威海今年预计614左右
录取概率,18***66 (青海),2018-06-27 10:43,青海理科考生，567分，排名527名，服从调剂，能否录取？,可以的，请放心报取
威海分校问题,sq***@sina.com (河南),2018-06-27 10:37,河南理科603排名15057有机会被威海分校录取吗,不好意思，机会可能比较小
录取,15***95 (云南),2018-06-27 10:22,贵校今年计划在云南通过高校专项录取几人？,校本部2人，威海2人
关于哈工大深圳,15***47 (广东),2018-06-27 10:21,哈工大深圳今年和本校区共用同一招生代码吗？计算机类专业在哪里就读？,深圳校区与本部分开招生，招生代码不一致，报考的哪个校区就在哪里就读
江西理科高校专项,13***38 (江西),2018-06-27 10:20,"你好，我高考610,6487名，有望进入贵校吗？",我们给出的统招参考线627，高校专项可参考前几年录取分数
您好,15***70 (黑龙江),2018-06-27 10:18,贫困县分数排名2500多，能考上贵校吗,黑龙江省全省排名2844以前均有希望报考我校
国家专项计划调剂,15***56 (河北),2018-06-27 10:17,老师您好，请问：我通过国家专项计划报考贵校，在调剂时，是在全校所有专业中调剂？还是在国家专项给定专业中调剂呢？,给定的专业中
关于选择专业,15***51 (湖南),2018-06-27 10:17,选择专业时民族加分是否有效选择专业时是否会逐专业减分,认可教育部和各省根据相关政策给予的加分，没有级差，不会逐专业减分
录取,13***23 (福建),2018-06-27 09:45,您好，福建考生分数642排名1236有多大把握可以录取进贵校的计算机类或者电气工程及其自动化的专业吗？,按照我校录取政策，福建省录取考生中高考成绩全省前1500名，满足第一专业志愿
高校专项提档问题,15***95 (云南),2018-06-27 09:38,高校专项提档是在已审核的考生中择优提档吗？,在报考的高校专项已审核的考生中择优录取
黑龙江理科考生关于专业及录取问题咨询,13***73 (黑龙江),2018-06-27 09:21,老师您好，黑龙江理科考生635，排名1800左右，想读贵校的工科专业有希望吗？如果专业被调剂，还会有机会转专业吗？,有，黑龙江省625分左右可报，你的成绩很有希望；可以转专业
高校专项,15***89 (江西),2018-06-27 09:16,老师您好！我是江西的一名理科生，已通过贵校高校专项计划初审，今年高考593分，被贵校录取的可能性大吗？,根据我校高校专项录取政策，如果考生成绩达到哈工大在江西省模拟投档线，则满足前三个志愿录取；如果考生成绩达到模拟投档线下60分以内且不低于江西省第一批次录取控制分数线，考生在省级考试机构规定的高校专项计划志愿位置填报我校高校专项计划专业，专业服从调剂，我校将根据公布计划按照投档成绩从高到低择优录取
关于提前批,15***66 (河南),2018-06-26 16:52,您好，哈工大在河南文科提前批的分数大概多少？会和一批分差多少？,现在招办没有给出提前批的参考分数。，河南本科一批的参考分数本部是645分左右可以报考，威海校区614分左右可以报考。
英才学院,18***56 (安徽),2018-06-26 15:34,安徽939名能否进英才学院？,安徽全省前800名录取到英才学院
报考,15***35 (河南),2018-06-26 15:10,您好，我是河南省理科考生，今年分数621，位次8451，报考贵校被录取希望大吗？是否很容易被调剂？,河南省报考哈工大本部的参考分数是645分左右
贵校的计算机专业很难报么,13***60 (黑龙江),2018-06-26 15:07,本人黑龙江考生，642分，本省排名1381，想报工大的计算机专业，又怕分不太够，服从专业调剂到不喜欢的专业，请问可以报计算机专业么。,黑龙江去年计算机类分数为631分，你可以参考该分数去年的对应排名。建议服从专业调剂，入学后有转专业机会
报考咨询,13***27 (河南),2018-06-26 14:32,老师您好！我是女生，请问河南文科考生622分，省内分数排名2011名，报考贵校有希望录取吗？谢谢！,我们这边给出的河南文史分数线在625分左右，省排名1761左右，所以，您的分数可能比较悬
国家专项计划,15***25 (河南),2018-06-26 13:35,河南581通过国家专项计划有希望被威海校区录取吗,具体信息可联系哈工大威海校区招生办电话：0631-5689455
咨询,13***16 (广西),2018-06-26 13:23,广西理科624，排名3021，能录到贵校吗？,广西分数在626分左右可以考虑报考
英才学院,18***56 (安徽),2018-06-26 13:01,安徽有几人能进英才学院,高考排名在全省前800名的录取到英才学院
关于色弱问题,18***56 (安徽),2018-06-26 12:50,有色弱，如果投档成功，会不会分到色弱不接受的专业而遭到退档？,色弱不能录取的专业有：化学类、生物科学类、工科试验班（功能新材料与化工）、环境科学与工程类。色弱考生在填报时避开此类专业即可
关于专业录取规则,18***56 (安徽),2018-06-26 12:47,请问贵校专业录取是分数清还是志愿清？,学校按照投档分确定最低录取分数线，按照投档分为考生安排专业，采用分数优先原则，专业之间无级差。
专业名称变化咨询,18***59 (四川),2018-06-26 12:14,请问去年的专业名”控制科学与工程“在今年的专业设置中是哪一类，我们在《高考合订本》没有找到对应专业，请教一下。,在航天学院自动化类
威海分校的毕业证书,15***09 (山东),2018-06-26 11:22,请问老师威海分校的毕业证书与本校的一样吗,一样的
山东考生,15***09 (山东),2018-06-26 11:12,老师您好！山东理科考生623分建不建议报考贵校？谢谢,山东理科650分以上可以考虑报考哈工大本部，620分左右可以考虑哈工大威海
新疆理科639，全省597，能录到贵校吗？,10***5@qq.com (新疆),2018-06-26 11:06,新疆理科639，全省597，能录到贵校吗？能通过国家专项，南疆单列录吗？,2015年，2016年，2017年在新疆录取排名分别为692，636，689。
麻烦咨询下贵校今年的招生,13***58 (甘肃),2018-06-26 11:04,麻烦问下，甘肃文史类考生，贵校今年在甘肃预估的文史类录取分数线是多少，大概多少分可以填报,我们现在还没有甘肃文史类的预估分数线
湖北考生627分,13***87 (湖北),2018-06-26 10:52,你好老师，湖北考生627分，省排6286名，被录取的可能性有多大？,湖北的参考分数是630分
高考提档,15***95 (云南),2018-06-26 10:31,高校专项考生的录取，是在报考的高校专项已审核的考生中，还是在所有报考考生中，择优录取？,在报考的高校专项已审核的考生中择优录取
关于哈尔滨工业大学深圳校区,13***30 (海南),2018-06-26 10:24,毕业证区别就是注明深圳校区培养的，是不是说深圳校区属于二级学院,只是注明在深圳培养，其他的没有区别。不是二级学院
关于哈尔滨工业大学深圳校区,13***30 (海南),2018-06-26 10:16,是不是本科阶段要几年在深圳读，几年在本部读,本科四年一直在深圳
关于哈尔滨工业大学深圳校区,13***30 (海南),2018-06-26 10:15,海南省排名660可以报考贵校分校区吗,您可以联系一下深圳校区招生办具体了解一下
关于哈尔滨工业大学深圳校区,13***30 (海南),2018-06-26 10:15,缺少历年海南志愿录取分数线，能不能给个大致范围,您可以联系一下深圳校区招生办具体了解一下
关于哈尔滨工业大学深圳校区,13***30 (海南),2018-06-26 10:12,深圳校区毕业证注明培养校区是什么意思，是不是跟哈工大本部的毕业证不一样，享受的待遇不一样啊,毕业证有区别
关于报考,18***28 (西藏),2018-06-26 10:08,我是西藏汉族理科考生，超出一本线169分可以考虑报哈工大吗？能上好专业吗？,可以考虑报考
关于哈尔滨工业大学深圳校区,13***30 (海南),2018-06-26 10:06,对海南考生报志愿的建议,可以根据自己的高考分数对应省排名及报考指南自行选择
关与威海校区,15***25 (河南),2018-06-26 09:55,威海校区与本部校区有什么区别，我河南581有希望被威海校区录取吗,威海校区的录取分数较低，河南省分数在614分左右可以考虑报考哈工大威海
关于录取,18***28 (西藏),2018-06-26 09:53,请问近几年在西藏汉族理科考生中大约多少名有把握可报考贵校？西藏没有往年的排名,请您参考一下往年的录取分数以及一本线
材料科学与工程,18***02 (贵州),2018-06-26 09:36,我是一名贵州考生，全省815，有希望参考材料科学与工程专业吗,该专业去年的分数线是638分，您可以看一下638分在去年的贵州省排名
提档线,15***95 (云南),2018-06-26 09:35,老师，今年贵校在云南的提档线大约是多少？,640分左右可以报考
吉林女理科578分排位9073 有可能吗,15***76 (吉林),2018-06-26 09:26,吉林女理科578分排位9073有可能吗,您好，吉林分数在640分左右可以考虑报考校本部，600分左右可以考虑报考哈工大威海
