标题,来源,时间,问题,回答
是否会被退档，气候适应,19***8 (陕西),2011-06-27 09:33,老师您好，我来自陕西，理工，628，报咱校会被退档吗？，还有，去了那后，会不会太冷，不适应，谢谢您的解答。,只要你能投档并服从调剂，就不会退档，来这边的学生一般都能适应的，不会太冷，你可以问一下在这边上学的老乡。
招生名次,52*** (河南),2011-06-27 09:28,老师你好！我是河南理科考生，考了647分，全省1887——2017名，上贵校有多大希望？我想知道上贵校一般须在全省前多少名？,有希望，我校去年在贵省招收的考生最低名次为1984名。
有可能被录取吗？,lm*** (河南),2011-06-27 09:27,我理科657分。942名有可能被录取吗？,基本没问题。
专业咨询,qi***a333 (陕西),2011-06-27 09:26,我是陕西理科考生，分数654，位次1143，请问可否报考贵校？贵校的优势专业是什么？,可以报考我校。我校的优势专业挺多的，比如：机械、电气、航天、通信、焊接、土木等等，你可以试试这些热门专业。
咨询录取,sd*** (山西),2011-06-27 09:18,山西一本线570，哈工大1比1投档线612，我考了608，一志愿哈工，二志愿威海校区，请问我能进本校区扩招么？怎么才能知道是否被威海校区录取？,你好，扩招的情况现在还不能确定。威海校区的录取通知书有威海字样。
录取,ct*** (陕西),2011-06-27 09:11,老师您好，我是陕西理科考生，今年610，高出一本线70分，位次是6372，有机会被录取吗？,有风险，请参考往年录取情况：http://zsb.hit.edu.cn/studentnews/user/score.asp?kprovince=陕西
河南文科606,ti***ge (河南),2011-06-27 09:11,老师您好！我是河南文科考生，高考成绩606，606及以上共715人，同分有50多人，（文科一本线562），报考哈尔滨工业大学有几分把握？能走好专业么?请老师帮忙过过手。谢谢！,你这个分数报考我校没问题，可以进一些比较好点的专业，可以结合自己的兴趣试试工商管理类、国际经济与贸易等专业。
咨询,ph*** (河南),2011-06-27 09:05,我是河南考生，考分614，报考贵校能被录取吗？,有风险，请参考往年录取情况：http://zsb.hit.edu.cn/studentnews/user/score.asp?kprovince=河南
咨询录取,wa*** (湖北),2011-06-27 09:05,我是湖北的考生，今年的高考分数是614，想要报贵校，录取的希望有多大？,有点风险，请参考往年录取情况：http://zsb.hit.edu.cn/studentnews/user/score.asp?kprovince=湖北
录取,cx***y (云南),2011-06-26 16:42,"老师,你好!，我是云南理科考生,考分554分(一本线465),请问报读贵校是否有希望?平行志愿如果服从调剂,调档后是否还会退档?","你好，08、09、10年我校在贵省的招生线比一本线分别高出：83、79、88分，去年我校在贵省招收的考生最低排名为2001名。平行志愿如果服从调剂,调档后是不会退档。"
咨询录取,50*** (安徽),2011-06-26 16:34,安徽629分1891名，录取希望？土木专业？,你好，我校在安徽省09年土木工程专业录取最低分高出一本线95分，10年高出79分，以你的分数报考这个专业有很大希望，但也要视你们省考生今年在该专业的报考情况。
咨询,wu***2 (河南),2011-06-26 16:25,贵校热门专业是什么,请参看各专业历年录取最低分http://zsb.hit.edu.cn/studentnews/user/score.asp
咨询,wu***2 (河南),2011-06-26 16:18,653分可以上贵校的主干专业吗,太热门的可能去不了。中等分数的还是可以的。
咨询,wu***2 (河南),2011-06-26 16:13,我考了653分，有几成把握上贵校,完全没有问题，欢迎报考哈工大。
贵校外语专业有要求吗？,mi*** (河南),2011-06-26 16:12,我是河南理科考生，报考贵校提前批外语专业需要参加口试吗?对英语单科成绩有要求吗?,你好，我们是没有特殊要求的。直接报考即可。
提前批,sh*** (河南),2011-06-26 16:12,请问俄语双学位必须是俄语考生才能报考吗，学习飞行器专业是否在本院学习吗，请详细回答,不是的，英语考生也可以报考，详细信息请拨打外国语学院俄语系招生办公室咨询，电话：0451-86414520.
请教,dg*** (天津),2011-06-26 16:09,请教老师，天津理科608能否录取光信息科学与技术，一定是本硕连读吗。谢谢,你好，你的分数报考该专业没有什么问题，一定是本硕连读，欢迎报考。
联系,wu***2 (河南),2011-06-26 16:06,河南招生组的屈老师手机关机，还有其他联系方式吗？,没有其他联系方式，请换个时间再拨打试试。
提前批,wu***i (河南),2011-06-26 15:56,请问贵校在一般情况下提前批是否会录取第二志愿学生？谢谢！,如果在第一志愿没招满的话我们会招第二志愿的。
平行志愿,ha***ang (天津),2011-06-26 15:52,老师您好，平行志愿的1.2.3.4院校是不是都属于第一志愿？学校会不会因为考生没有在平行1填报而不录取啊？,你好，平行志愿的1.2.3.4院校都属于第一志愿，不会因为没填报第一个而不录取，但是建议你把我们学校放在第一位，会增加录取的几率。
山东理科？,xi***ei (山东),2011-06-26 15:52,我成绩为642，名次大约为3800，能否进入贵校？专业如何？,"你好，我校08-10年在山东录取最低分高出重本线分数分别为59/54/71,10年最低分排名2978，以你的情况报考有一定希望，专业选择的余地会小一些。"
资询--提前批,zx***2 (山东),2011-06-26 15:49,您好，我是山东考生，想报贵校国防生，617分差点的系能走吗,你好！08-10年我校在山东国防生录取最低分高出重本线分别为43/37/20，请根据这个情况你的分数应该没有问题，欢迎报考。
有可能被录取吗？,hq*** (云南),2011-06-26 15:49,老师你好，我是云南考生，考分597，高出云南一本线131分，有多大的把握录取？可以录取在热门专业吗？,你好，你的分数报考我校完全没有问题，录取到热门专业也是没有问题的，极有可能被选入英才学院，建议你报考英才学院英才班的对应招生专业。
联系,wu***2 (河南),2011-06-26 15:46,贵校在河南招生组的联系方式是什么？,曲老师，，，18637179017
会退档么？,yu***ndhjs (天津),2011-06-26 15:46,天津理科604，服从专业调剂：提档率是多少？能否“见档不退”？,我们调档比例为招生计划的105%，你只要服从调剂我们是不退档的，一定会被录取的。
国防生,zx***2 (山东),2011-06-26 15:44,山东考生报贵校国防生最低要多少分呀,你好！08-10年我校在山东国防生录取最低分高出重本线分别为43/37/20，请根据这个情况酌情酌情报考。
志愿,32*** (陕西),2011-06-26 15:35,老师，你好！我陕西省的一名理科考生，今年考了552分是否可以报考哈尔滨工业大学，如果可以，1本能报哪些专业，2本又能报哪些专业？,你好！我校不招收2本考生。你的分数报考不了我校。
咨询,jh*** (浙江),2011-06-26 15:26,分数如果学校够到学校提档，服从志愿分配，会不会被退档？,不会的，只要你服从调剂我们调档即会录取。
山东理科生641,la***0721 (山东),2011-06-26 15:26,山东理科生641，过线74。能否上贵校？热门专业是否可以？又有哪些？,你的分数报考我校有希望被录取，但是可能去不了太热门的专业。
咨询,sh***i (山东),2011-06-26 15:16,你好，我是山东理科考生601分超一本线34能上威海校区么,你好，我校与威海分校是分别招生，了解详细情况请拨打威海分校招生办电话：0631-5687013
对视力有特殊要求么？,yu***ndhjs (天津),2011-06-26 15:15,是否高考前体检过关就可以报考？,一般专业是没有特殊要求的。
专业咨询,su*** (陕西),2011-06-26 15:12,你们学校的强势专业有哪些?航天类专业有那些,我校工科专业都很好，航天类专业请详询航天学院招生办。
山东考生咨询专业,to***1 (山东),2011-06-26 15:10,老师，您好，我是山东理科考生，627分，超一本60分，报本校的汽车专业，有多大希望啊？另外哈工大，和哈工大威海分校有没有什么区别呢？期待您的回复，谢谢,你好，汽车专业本部没有这个专业，威海分校与本部的校址不同，师资也难免会有一些差距，但是威海分校毕业证及其他待遇和本部是一样的，同样是985、211院校，具体关于威海分校的问题请拨打威海分校招办电话0631-5687013
咨询,lx*** (河北),2011-06-26 15:08,若报考贵校的河北省前1800名学生报贵校热门专业比较集中，贵校如何保证一定满足所报志愿？,我们是满足你所报的几个专业之一，但是若这几个专业都很火我们也会满足把考生录到其中之一的。
天津理科604，有可能被录取么？,yu***ndhjs (天津),2011-06-26 15:06,填报了贵校专业，并服从调剂，有可能被录取么？,极有肯能，欢迎报考。
报考咨询,62*** (河南),2011-06-26 14:58,老师您好，我是河南理科生，成绩642，报考贵校材料类或化学类是否能被录取。谢谢,有一定希望，关于各专业录取分区情况可以参见http://zsb.hit.edu.cn/studentnews/user/score.asp
咨询,fu***993 (山东),2011-06-26 14:45,老师您好，我山东理科649，报考贵校有多大把握，能明确一点吗？谢谢,有很大希望，欢迎报考。
报考咨询,he***heng1222 (海南),2011-06-26 14:38,老师您好，我是河南理科生，成绩是642，请问报考贵校材料类或化学类能否录取。谢谢,你好，你的分数报考我校有一定希望，关于专业录取情况请参见历年各专业录取最低分http://zsb.hit.edu.cn/studentnews/user/score.asp
咨询,hz*** (福建),2011-06-26 14:33,您好，我是福建理科考生，我高考成绩是662分，若报考贵校，是否可以进入最好的系学习？,你好，以你的分数报考我校任何对福建省招生的专业都没什么问题，还极有可能被录入英才学院，欢迎报考哈工大！
录取,cj*** (湖北),2011-06-26 13:59,湖北理科612分能被贵校录取吗？,你好，我校去年在湖北录取最低分排名6668，最低分高出重本线45分，以你的分数报考有希望被录取，也有一定风险，请根据排名情况再酌情报考。
报考咨询,kt***66060 (江苏),2011-06-26 13:48,我是江苏理科考生，总分373选修AA，排名全省6093，能否报考贵校（今年我省理科本一分数线345）,你好，你的分数有希望被我校录取，去年我校录取最低分高出重本线27分，最低分排名9655，根据以上情况请你酌情报考。
咨询,ki*** (河南),2011-06-26 13:47,我是河南考生，分数620报您校可以吗？有机会吗？,你好，你的分数报考哈工大希望不大，不建议报考。
是否能上贵校,71*** (福建),2011-06-26 13:44,我是福建的考生我的分数是631能上贵校吗,你好!08-10年我校在福建录取最低分高出最重本线分别为52/55/54，你的情况报考哈工大有一定希望，但是也有风险，请酌情报考。
报考咨询,jb*** (江苏),2011-06-26 13:41,江苏理科考生，总分358全省排名19205，物化A+、B，能否报考贵校，谢谢！,风险很大，不太建议报考。
联系方式,hu***e (河南),2011-06-26 13:34,请问贵校河南招生组的联系方式,曲老师，，，18637179017
湖北考生,ro*** (湖北),2011-06-26 13:15,湖北考生理科602报考贵校的把握有多大?可以按照自己选的专业就读吗？,风险很大，请慎重报考。
河南理科638报考贵校有可能吗,li***g6888 (河南),2011-06-26 13:07,河南理科638报考贵校有可能吗,有一定风险，请酌情报考。
录取   分专业,dm*** (内蒙古),2011-06-26 13:02,“承认各省（自治区、直辖市）招生主管部门根据教育部相关政策给予的加分按考生实际高考成绩安排专业”，意思是我考了618如果贵校提档线600的话少数民族照顾分10分就没用了，是吗？,是的。
1800,lx*** (河北),2011-06-26 12:55,请问1800名这个政策去年有吗（河北省）,你好，去年是没有的，今年是第一年。
报考,89*** (福建),2011-06-26 12:49,老师你好，我是福建理科考生，总分634，本一切线是573，高出61分，不知报考哈大希望大不大，如果进的话，大概能上什么专业？谢谢了！,你好!08-10年我校在福建录取最低分高出最重本线分别为52/55/54，你的情况报考哈工大有一定希望，但是也有风险，请酌情报考。
609,wo***86 (河南),2011-06-26 12:48,本人河南理科考生609分报考贵校有希望吗？,希望不大，不建议报考！
咨询,82*** (天津),2011-06-26 12:43,您好，我是天津理科考生，天津一本线为515分，我高考成绩是644分，若报考贵校，是否可以进入最好的系学习？,你的分数报考我校任何专业都没什么问题，欢迎报考！
住宿环境,do***ong (天津),2011-06-26 12:31,那具体有哪些学院宿舍是4人的，哪些学院宿舍是6人的呢？,我校基础学部负责大一新生的管理，请拨打基础学部电话详细了解。电话0451-86283695
专业咨询,jt*** (甘肃),2011-06-26 12:04,老师，您好！我是甘肃理科考生，排名2180名，高出一本线69分，请问报考贵校威海分校的车辆工程专业，有无可能性？,你好，我校与威海分校是分别招生，了解详细情况请拨打威海分校招生办电话：0631-5687013
1800,lx*** (河北),2011-06-26 12:03,河北省前1800满足专业包括所有专业吗如本硕连读的专业,绝大多数是可以的，不包括一些有限制的专业，比如艺术类考生的专业。本硕连读的可以报，但是我们只满足你所报的几个专业之一，不一定能满足你的第一志愿，也请填满专业志愿。
报考,an***er (河南),2011-06-26 11:59,老师您好.我是河南考生，607分，能报贵校的提前批俄语与飞行器双学位专业么？很喜欢飞行器专业，希望能得到老师建议，谢谢了,你好，今年俄语飞行器这个专业是第一年招生，因此分数上没有以往准确的参考，也不清楚河南考生今年在该专业的报考情况。去年俄语专业在河南理科录取最低分为590，请你酌情报考。
提档线,38*** (山西),2011-06-26 11:56,老师，您好！，请问山西省今年贵校提档线何时能出来，能在哪里查到？,"你好!还没有出来,请耐心等待。"
录取情况,lx*** (河北),2011-06-26 11:53,老师你好，能不能提供一份2010各专业录取分数,http://zsb.hit.edu.cn/studentnews/user/score.asp
咨询,pe***t (青海),2011-06-26 11:52,我是青海考生，分数416分。排名3377，报威海分校的焊接技术与工程能上吗？,你好，我校与威海分校是分别招生，了解详细情况请拨打威海分校招生办电话：0631-5687013
转专业,wy*** (吉林),2011-06-26 11:48,请问一年后从其他专业转到建筑学专业，是从一年级开始学习还是直接上二年级,大二补大一相关的课程
咨询,sd*** (山东),2011-06-26 11:43,老师：我是山东理科考生661分，另有自主招生30分加分，能去贵校英才本硕博机械专业连读班吗？请给个明确回答好吗？,你好！这要视我们与你的协议是怎么写的，如果还不明白可以拨打我们招办的电话或是把你协议上的具体内容告诉我。
咨询,pe***t (青海),2011-06-26 11:39,青海考生416分，报焊接技术与工程行吗?排名3377名,你好，我校焊接技术与工程在青海不招生，请仔细阅读招生简章。
提档？,89*** (河南),2011-06-26 11:33,"理科考生644,2518名，高出一本线62分，请问报贵校可以被提档吗？希望有多大？谢谢",你好！我校去年在河南录取最低分排名1987，高出重本线67分，以你的情况报考有一定风险，具体情况也要是河南考生今年报考我校的情况而定，请酌情报考。
河南理科考生,lz*** (河南),2011-06-26 11:29,633分高出一本线51分有希望被贵校录取吗,风险很大，慎重报考！
咨询,wu***2 (河南),2011-06-26 11:29,贵校的特色转于是什麽,我校工科方面的专业都很强。
咨询,wu***2 (河南),2011-06-26 11:21,我的分数是653，报考贵校能源动力类专业有希望吗？,有很大希望，可以报考。
咨询,ca***n (山东),2011-06-26 11:19,请问在近几年贵校第一次能录取够吗？,不一定，像去年因为生源质量好我们又进行了补，这要视考生报考情况而定。
河南文科咨询,wa***angchun (河南),2011-06-26 11:15,我今年文科河南583分，可否报考你们学校？,你好！你的分数报考我校有很大希望，欢迎报考！
排名,gn*** (河北),2011-06-26 11:09,老师你好，我是河北理科考生，高考总分在河北排名656名。请问报贵校有多大希望？,你好！你的分数报考我校完全没有问题，另外，我校对河北排名前800的考生可以满足第一专业志愿，欢迎报考！
英才班,hb***6 (河北),2011-06-26 11:03,我是河北考考生，有自主招生“进入投档线后加10分的政策”，实际考分664，省排名700多，如加上10分为300多名，贵校在河北有“前400的考生进入精英班的政策”不知自主招生的加分在排名上是否算数？如果在本一特殊类型批填报，我能否进入精英班?,你好！请咨询我校负责河北招生的张老师，电话为13131135465
河南理科638敢报贵校吗,li***g6888 (河南),2011-06-26 11:00,河南理科638敢报贵校吗，排名3733，高出一本线56分,你好！我校08-10年在河南录取最低分高出一本线分别是44/48/67，去年最低分排名1984，以你的情况报考我校有很大风险，不太建议报考。
咨询,hu***829 (内蒙古),2011-06-26 10:59,"内蒙古自治区高考理科生,分数595,排自治区1058名,报你校什么专业?",以你的分数应该能我校很好的专业，不过也得看你自己的喜好，也请参看我校各专业在全国的排名情况报考专业。
录取,fe*** (河南),2011-06-26 10:51,河南一本线582，我是629，请问能否报考贵校，以及能报什么专业？,你好！我校08-10年在河南录取最低分高出一本线分别是44/48/67，去年最低分排名1984，以你的情况风险很大，还请根据排名情况酌情报考。
报考,xu***g0310 (江苏),2011-06-26 10:51,老师您好！我是江苏文科的考生。我的高考三门总分是356，两门选修都是A+。江苏省文科排名是4320。请问能进哈大吗？,你好！希望很大，欢迎报考。
录取,xu*** (河南),2011-06-26 10:49,你好！我是河南文科考生，高考成绩573，省定一本线562，报考你们学校机会大吗？,你好，我校09、10年录取最低分高出重本线15、20分，以你的分数有一定风险，请酌情报考。
高招,wu***2 (河南),2011-06-26 10:47,今年我考了653分，能报考贵校能源动力类专业吗？,你好！你的分数报考该专业没有什么问题，欢迎报考！
咨询,66***gcheng (安徽),2011-06-26 10:38,我是安徽一名理科生，今年高考625分，超出一本线91分，全省排名2342名，能上贵校的好专业吗？,你好！我校在安徽10年最低分排名2443，你的这种情况有希望被我校录取，但是专业不会有太大的选择余地。
咨询,li***ndy (河北),2011-06-26 10:38,请问：我的高考成绩为658分，报考贵校的建筑学专业有多大把握？,你好！09-10年我校建筑学专业在河北录取最低分分别超出一本线66、65分，以你的分数报考该专业希望极大，没有什么问题。欢迎报考哈工大！
咨询,93*** (湖北),2011-06-26 10:36,湖北理科考生602分能上贵校吗,你好！我校08-10年在湖北录取最低分高出重本线分别是33/47/45，10年录取最低分排名为6668，以你的分数报考我校有一定的风险，具体还要参照你的排名情况，请酌情报考。
666,gn*** (河北),2011-06-26 10:34,老师您好，我是河北理科考生656分加独生子女10分，总计666分。河北一本线581分，请问我被贵校录取的机会有多大?,你好！完全没有问题，欢迎报考哈工大！我们对于排名在前1800的河北考生可以满足专业志愿，即保证考生录取到所报专业的志愿当中的一个，各专业志愿录取人数不受招生计划的限制，但是考生须填满专业志愿。
国防生,y9***6 (河南),2011-06-26 10:34,老师您好，我是河南考生，分数629，能报贵校国防生吗？录取可能性大吗？谢谢！,"你好，08-10年，我校在河南录取最低分高出重本线分别是44/48/67,10年最低分排名1984，国防生录取最低分高出重本线分别为31/34/39，以你的分数报考国防生没什么问题。"
咨询,zh*** (浙江),2011-06-26 10:30,老师好，浙江杭州理科成绩580，一本线550，可能上贵校威海校区吗？浙江平行志愿，投档后退档的可能性如何？,你好！我们和威海分校是分别招生的，因此详情请咨询威海分校招生办，威海分校电话0631-5687013
咨询,95*** (河南),2011-06-26 10:26,我是河南考生，今年高考成绩649，能报考贵校吗？如果能的话，是什么档次的专业？谢谢,你好，08-10年，我校在河南录取最低分高出重本线分别是44/48/67，10年最低分排名1984，以你的分数报考我校有一定的希望，专业可能回去一些不太热门的专业，具体还是参照排名情况斟酌报考。
录取,xu***3 (浙江),2011-06-26 10:22,1.我是浙江考生，高考成绩588，超一本线38分，全省排名15924，请问能否被贵校的威海校区录取，并进入土木工程专业?，2.贵校的威海校区的投档比例为1:1.05，如果提档了105人，且这些人全部服从调剂，那么这些人都会被录取吗？，3.不退档是不是就是录取了？，我的问题比较多，您辛苦了，谢谢,你好！我们和威海分校是分别招生的，详细情况请拨打威海分校招生办电话：0631-5687013
专业,zx*** (河南),2011-06-26 10:21,贵校什么专业比较好？谢谢,我校工科方面的专业都很好，你可以从网上看一下各专业在全国的排名，再酌情报考。
622,we***uke (河南),2011-06-26 10:14,我是河南理科考生，622分，高出一本线40分，报考贵校有希望吗？,你好！我校08-10年在河南录取最低分高出一本线分别是44/48/67，去年最低分排名1984，以你的情况风险很大，还请根据排名情况酌情报考。
报考咨询,lu*** (浙江),2011-06-26 10:08,请问我是浙江理科627省排名5593有希望进贵校吗？,你好！我校去年在浙江录取最低分高出重本线65分，最低分排名5871，以你的分数和排名报考我校是有希望的。
录取,10***5 (河南),2011-06-26 10:07,我考了636分，是理科考生，今年16岁，上您校的机率有多大？国防生分数低吗？,"你好，08-10年，我校在河南录取最低分高出重本线分别是44/48/67,10年最低分排名1984，国防生录取最低分高出重本线分别为31/34/39，以你的分数报考哈工大有一定希望也有一定的风险，还是参照排名情况斟酌报考，如果报考国防生应该没什么问题。"
咨询,dg*** (天津),2011-06-26 10:06,请问老师，天津理科608分，能否录取，谢谢。,你好！以你的分数报考哈工大没有问题，欢迎报考！
内蒙古的，车辆工程需要考多少分啊,ne***1 (内蒙古),2011-06-26 10:01,需要多少分,你好，哈工大本部没有这个专业。请咨询威海分校招生办，威海分校电话0631-5687013。
咨询,19*** (天津),2011-06-26 09:59,贵校的两个校区有什么区别,威海分校是我们在威海开的一个分校，威海分校也同样是985、211，毕业证也是一样的，唯一的不同就是校址不用，师资方面较本部有一定的差距，但近些年来发展也很快，认可度在逐渐提高。
咨询,an*** (安徽),2011-06-26 09:50,我考604高出70分能被贵校录取吗,你好！我校08-10年在安徽理科录取最低分高出一本线分别为58/65/75，10年录取最低分排名为2443，以你的分数报考我校有一定的希望，也请参见排名情况酌情报考。
招生组,zh***011 (山东),2011-06-26 09:48,老师您好，请问哈工大（威海）在山东有招生咨询会吗？联系方式？谢谢！,你好！威海分校招生办电话:0631-5687013，详细情况请问威海分校招生办。
533,af*** (内蒙古),2011-06-26 09:47,老师您好，我是内蒙古理工类考生，分数533，报考贵校希望大不大？能否进入不错的专业？内蒙古一本分数线482.,你好！我校08-10年在内蒙古录取最低分高出重本线分别为71/88/89，以你的情况我们不建议报考。
咨询,sl*** (山东),2011-06-26 09:45,老师您好我是今年山东考生考了638排名4000左右高出一本分数线71分咨询一下是否有希望报考贵校另外如果可以考到贵校不知是否可以选到飞行器专业谢谢,你好！我校去年录取最低分高出重本线71分，09年高出54分，08年高出59分，10年录取最低分排名2978，以你的分数报考我校有一定风险，还是请你根据排名情况酌情报考。
