标题,来源,时间,问题,回答
专业,ha*** (河南),2010-05-12 12:22,您好！我已通过您校自主招生A档优惠，在填报专业时是否受本省专业计划的限制？是否可以填报本省计划外的专业？您校电气工程及自动化、热能与动力工程、建筑环境与设备工程专业对色盲有限制吗？（体检标准太笼统，我想知道具体的专业要求），谢谢！,1.平行志愿省份自主招生合格考生提前提档不占用计划。非平行志愿省份提档线上考生不占用招生计划，线下考生占用计划。，2.不可以填报本省计划外的专业，3.不受限制
咨询专业填报顺序,zy***2 (北京),2010-05-12 12:15,"老师好,请问如下的顺序合理吗?，1.机械设计制造及自动化2.工科试验班(英才班)3.自动化4.材料科学与工程5.建筑环境与设备工程，谢谢.",专业要看你个人爱好、个人的发展方向填报。
提前批次的俄语、日语专业,gu***i (山西),2010-05-12 11:48,报考提前批次的俄语、日语专业承认取得自主招生资格加分政策吗？如果提前批未被录取，第一批次仍然报贵校，取得自主招生资格加分政策还可以用吗？,1.自主招生提前批不加分，2.第一批次加分
中外合作专业,xi*** (北京),2010-05-12 11:46,请问贵校有没有中外合作专业？,http://zsb.hit.edu.cn/subindex/studentnews/zswenda2.asp
专业录取分数,ou*** (天津),2010-05-12 11:44,老师您好，请问2009、2008、2007年食品科学与技术专业的录取分数和人数？另外，贵校该专业与国外哪些国家有交流，将来到国外读研一般有哪些国家和大学？谢谢,1.该专业近3年均未在天津招生，2010年也没有招生计划，http://61.167.60.52/studentnews/user/newplan.asp?kprovince=天津，2.食品科学与工程专业.（招生咨询电话：045186282907），，，，--------------------------------------------------------------------------------，，食品科学与工程是以现代科学、技术与工程为基础，以食品生产、加工、包装、贮藏、流通、消费、环保等为其主要研究内容，以食品卫生、营养、感官品质等食品质量及其变化、维护、检验、评价等为研究中心，并与现代管理科学、人文科学、市场营销等学科有密切的联系，现代食品科学与工程已发展为一门跨学科的综合性科学。，，食品科学与工程专业培养具有化学、生物学、食品工程和食品专业技术知识，能在食品领域内从事食品生产技术管理、品质控制、产品开发、科学研究、工程设计等方面工作的食品科学与工程学科的高级工程技术人才。，，主干课程包括：生物化学、微生物学、食品化学、食品工程原理、食品营养学、食品卫生学、食品工艺学、食品物料学、食品保藏原理与技术。该专业培养出的毕业生在新产品、新工艺、新技术的研究开发和工程设计、经营技术管理等方面均有扎实的基础和实践、创新能力，并充分具备进入研究生阶段继续学习的能力。毕业生适合在下列部门：海关、商检、标准计量、卫生防疫、环境保护等有关食品检验、检疫与质量监督部门工作，各类食品加工企业，相关高校和科研设计单位等。随着我国食品工业的快速发展，食品科学与工程专业有着很好的前景。
浙江理科生,xz*** (浙江),2010-05-12 11:39,您好:请问贵校在浙江有招生计划吗?贵校经济类专业有实验班吗?考研有机会有多大?经济类专业毕业后就业好吗?,1.http://61.167.60.52/studentnews/user/newplan.asp?kprovince=浙江，2.没有，3.4.http://zsb.hit.edu.cn/subindex/intro/finacal.asp
再问实验学院与英才班问题,ji*** (广东),2010-05-12 11:31,老师您好！，1、我昨天问过“选拔进入实验学院与英才班成绩排序方法”，得到回答是：选拔进入实验学院与英才班以高考原始分（+哈工大自主招生合格的相应实验学院与英才班加分为标准）。是否可以理解为：取得哈工大自主招生资格的考生只有小部分有“相应实验学院与英才班加分”资格，其它大部分只有20分选专业加分，而没有“相应实验学院与英才班加分”（体现在协议书中）。，2、另外，按学校招生信息中所说：“高考成绩进入我校各录取省份前2名的一志愿考生，若所在省份招生计划超过50人，且录取专业是本、硕连读设置的专业，将优先录取”，广东应该有2人可进入实验学院，而广东的招生目录中有英才班1人，按常理，进入英才班的1人应该是广东考生中分数最高的，那么，最终广东考生应该是：1人进英才班、2人进入实验学院，还是1人进英才班、1人进入实验学院（进英才班的1人占用了进入实验学院的名额）？,1.正确，取得哈工大自主招生资格的考生只有小部分有“相应实验学院与英才班加分”资格，2.进英才班的1人不占用进入实验学院的名额
河南洛阳,ly*** (河南),2010-05-12 11:21,请问：河南洛阳市全市理科生2万4千多人，我女儿一练632分、二练629分，排名都在100名左右，无任何加分项目。根据往年情况，大约超过一本线50----60分左右。1、报贵校可否？2、报贵校什么专业比较有把握。3、眼睛近视750度，报贵校什么专业受限制？4、服从调剂时可以不退档吗？5、进校后可否转专业。谢谢。,1.2.请参照我校历年分数报考http://zsb.hit.edu.cn/studentnews/user/score.asp?kprovince=河南，3.我校是普通高等学校，对考生的身体要求按教育部、卫生部、中国残联印发的《普通高等学校招生体检指导意见》的标准执行。http://61.167.60.52/subindex/studentnews/zszhengce5.asp，4.服从调剂时不退档，5.大学一年级结束后，学习成绩（平均学分绩）排在本专业前10%的学生（定向生、艺术设计专业考生除外），可根据本人兴趣重新选择专业。因健康原因或学习能力取向不适应原专业学习的学生也可根据学校相关规定调换专业。
再问：电子封装专业是一个独立新设专业，今年没有单独招生吗？,by*** (新疆),2010-05-12 11:14,再问：电子封装专业是一个独立新设专业，今年没有单独招生吗？,按大类招生，入学一年后分专业
实验学院与英才班加分,gu***i (山西),2010-05-12 11:13,哈工大自主招生合格的相应实验学院与英才班加分标准是什么样的标准,这要看你自主招生合格后签署协议书上是否有实验学院与英才班相应的加分，如果没有不予在实验学院与英才班上加分
咨询美术类,ji***2 (黑龙江),2010-05-12 11:09,统考成绩达到贵校在黑龙江省所在的录取批次线，，请问录取批次线是多少呢？,术科一本线去年是214分
急！！！请问老师：今年贵校电子封装专业在全国各地招多少学生？,by*** (新疆),2010-05-12 10:44,请问老师：今年贵校电子封装专业在全国各地招多少学生？,焊接技术与工程（类）80人，请看我校2010年招生计划http://zsb.hit.edu.cn/studentnews/user/newplan.asp
招生计划问题,ch*** (黑龙江),2010-05-12 10:41,老师您好！因获得自主招生资格，请问自主招生资格获得者，在录取时占贵校公示的黑龙江招生计划名额吗？,平行志愿省份自主招生合格考生提前提档不占用计划。非平行志愿省份提档线上考生不占用招生计划，线下考生占用计划。
专业问题,ch*** (黑龙江),2010-05-12 10:39,因已经获得贵校自主招生文科资格，想问下老师贵校的文科优势学科是什么？就业率如何？如果高考分数580分，加20分可能进入经济、金融或者是会计学专业吗？，另外是否是哈工大今年录取政策实行改革，在所填报的几个专业中一定能被其中一个专业录取，文科招生也同样适用吗？,1.文科专业，人文与社会科学学院：社会学（文科）国际经济与贸易（文科），法学院：法学（文科），外国语学院：英语（文理兼招）俄语（文理兼招）日语（文理兼招），经济与管理学院：市场营销（文理兼招）、会计学（文理兼招）、财务管理（文理兼招）、金融学（文理兼招）、国际经济与贸易（文理兼招），2.http://61.167.60.52/subindex/studentnews/jiuyeqingkuang.asp，3.请参照历年分数报考http://zsb.hit.edu.cn/studentnews/user/score.asp?kprovince=黑龙江，4.黑龙江具体的招生录取政策将会陆续公布
咨询,ya***n (辽宁),2010-05-12 10:33,请问威海校区艺术特长生加分政策是否有可能在报考黑龙江主校时起作用,您好，威海校区艺术特长生加分政策在报考黑龙江主校时不起作用。
今年江苏录取选科等级,yy*** (江苏),2010-05-12 10:25,今年江苏录取选科等级,理科考生：AA（物理必选），文科考生：AA（历史必选）
录取专业,re***8 (陕西),2010-05-12 10:21,请问贵校的车辆工程、材料工程、土木工程、机械工程录取时分别看中哪几门课的成绩？市级优秀学生干部有无优惠政策？,1.看高考整体分数，2.我校在提档时承认考生所在省份招办遵照教育部相关规定的政策加分，在分专业时候去掉加分。
专业,ba***92 (黑龙江),2010-05-12 10:02,黑龙江考生报贵校的通信工程专业640分能录取吗？,2009年最低分数，黑龙江通信工程理工650，请参照历年分数报考，http://zsb.hit.edu.cn/studentnews/user/score.asp?kprovince=黑龙江
专业咨询,zj*** (浙江),2010-05-12 10:00,老师好!，请问自动化专业学生读研和就业状况如何?,学生培养特色，读研就业情况，，http://zsb.hit.edu.cn/subindex/intro/robotization.asp，“控制科学与工程”一级学科下设4个二级学科，具有硕士、博士学位授予权，并设有博士后流动站。其中的导航、制导与控制二级学科为国家级重点学科，是“211工程”和“985工程”重点建设学科，也是长江学者特聘教授岗位设置学科；控制理论与控制工程二级学科为国防科工委重点建设学科。2007年“控制科学与工程”被评为一级学科国家重点学科。自动化专业毕业生有60%以上可保送、考取硕士研究生，另有近20%的学生选择出国继续深造，直接就业的学生可面向电子、电力、石化、航空、航天、电信、交通、国防及国民经济各领域从事自动控制系统的教学、科研、开发、经营及管理等工作。
吉林考生家长咨询,gk*** (吉林),2010-05-12 09:48,尊敬的老师您好！请问贵校2010年在吉林省有小语种招生计划吗？都是什么专业，计划多少人？在哪个批次录取？衷心的感谢！，吉林考生家长,1.小语种招生，吉林俄语文史3，吉林日语文史2，吉林俄语理工3，吉林日语理工2，2.提前批
咨询录取方面的问题,fc*** (黑龙江),2010-05-12 09:36,你好，我曾参加过贵校今年的自主招生考试，差几分没有录取，若还报考贵校，能否有什么优惠政策,您好，未取得自主招生合格的考生不享受相应的政策
专业咨询,yx*** (北京),2010-05-12 09:21,请问贵校老师信息安全专业和信息安全（保密管理）有何区别,您好，我们学校只有信息安全专业没有信息安全（保密管理）专业方向，http://61.167.60.52/subindex/intro/academyintro.asp
咨询,56*** (黑龙江),2010-05-12 09:12,"两眼视力分别为4.1和4.6,有限报的专业吗?能制作机器人的属于哪个学院什么专业",1.我校是普通高等学校，对考生的身体要求按教育部、卫生部、中国残联印发的《普通高等学校招生体检指导意见》的标准执行。，http://61.167.60.52/subindex/studentnews/zszhengce5.asp，2.机电工程学院的机械设计制造及其自动化（类）
贵校威海校区承认自主招生资格吗,gu***i (山西),2010-05-12 09:11,我孩子是被哈工大认定为2010有自主招生资格的山西考生，想咨询贵校的威海校区承认孩子的自主招生资格吗？如果承认，孩子报考贵校的威海校区也可以降分录取吧,您好，威海校区不承认校本部的自主招生资格
新疆理科考生,dk*** (新疆),2010-05-11 16:45,老师您好:请问贵校建筑环境与设备工程在新疆招生吗?一次就业率高吗?保研的比例上多少?若高出一本线160分有把握吗?非常感谢,1.建筑环境与设备工程招收理工考生2人。2.3.建筑环境与设备工程专业的毕业生去向可归纳为三大类。一是直接就业，此类学生所占比例为60%。就业范围为：大专院校、设计院、合资企业、政府职能部门（公务员）等；二是考研，此类学生所占比例为27%；三是直接保送本校硕士研究生或推荐到外校攻读硕士研究生，此类学生所占比例为10%，是根据本科前五学期成绩综合排名取前10%。历年统计毕业一次就业率大于95%，用人单位在全国诸多院校同专业中优先录取我校毕业生，学生在走向社会后受到好评，“工作踏实”、“进入角色快”、“能力强”是我专业毕业生的特点，毕业生对学校专业课教学十分满意。学位率100%，考研录取率为68%左右。，4.请参照历年录取分数报考：，http://zsb.hit.edu.cn/studentnews/user/score.asp?kprovince=新疆
贵院的山东分学校和本院一起招生吗,xj*** (新疆),2010-05-11 16:22,你好，清问山东分院的计划有吗，新疆现在很多内地的网站登陆不了，分院的毕业证书和本院有区别吗,您说的是哈工大威海校区，毕业证书是一样的，没有“（威海）”字样，，哈尔滨工业大学（威海）2010年招生计划，，		新疆，总计		25，	，车辆工程	理工	2，热能与动力工程	理工	2，交通运输类	理工	2，自动化	理工	2，电气工程及其自动化	理工	2，电子信息工程	理工	1，通信工程	理工	2，电子科学与技术	理工	2，计算机科学与技术	理工	2，数学类	理工	2，材料科学与工程	理工	2，机械设计制造及其自动化	理工	2，土木工程	理工	2
咨询,zj*** (浙江),2010-05-11 16:15,你好!能介绍一下近年来通信工程专业毕业生就业方向及相关情况吗?谢谢!,通信工程专业创建于1958年，目前是哈尔滨工业大学热门专业之一。该专业为教育部特色专业，工业和信息化部重点专业，该专业具有硕士学位和博士学位授予权。专业主要培养通信与电子信息工程领域中从事信息科学研究、无线通信系统设计、通信设备研制及电信网络运营管理等方面高级研究及工程技术人才。该专业毕业生除了40％在国内外继续攻读硕士、博士研究生外，主要就业方向包括国家航天及电子信息高技术科研单位，国家电信企业，中外合资、外国独资的通信技术开发和通信设备生产企业，国有和民营通信及电子信息技术开发和通信设备生产企业等。，电磁场与无线技术专业方向为工业与信息化部紧缺专业。该专业方向研究射频无线电信号的产生、辐射、传播、散射、接收、测量和处理的相关理论、技术和工程应用，是涵盖无线通信、雷达、导航及遥测遥控等领域的通用技术专业。该专业主要培养适合于航天航空、通信、信息及国防电子等领域的微波、射频与天线方面高级专业人才。由于近年来电子信息与无线通信技术的迅猛发展，而国内设置该专业的院校较少，同时微波、射频及天线方面的硕士博士毕业人才紧缺，因此目前该专业方向的毕业生在社会上供不应求。
咨询,gu***18 (河南),2010-05-11 16:10,贵校文科专业保研几率大吗？,根据大学前三年的学习成绩将有15％以上的学生免试攻读硕士研究生
咨询,he***heng110 (河南),2010-05-11 15:57,女生报考贵校的什么专业好就业？请给点指导，谢谢！,我校除国防生考生有性别要求外，其他专业均不限性别，报考志愿是根据考生个人发展和喜好紧密结合的，请根据个人情况进行填报。
自主招生,zj*** (浙江),2010-05-11 15:56,"中规定""省教育考试院对达到所报高校同批次控制分数线的有关考生，在普通第一批提前录取最后一天单独向高校投档，录取与否由高校决定。已被自主选拔、艺术特长生录取的考生，后面各批次将不再录取。""，是否可理解为:提前批录取,是否在提前批单独填报贵校志愿及专业?",自主选拔考生、艺术特长生在提前批录取最后一批次录取前进行投档同提前批录取是有区别的具体填报贵校志愿及专业要遵照浙江省招办的相关规定进行填报
招生问题,he***heng110 (河南),2010-05-11 15:53,贵校今年自主招生1000多人，是不是意味着没有自主招生资格的学生考上贵校更困难了？这类考生占用各省的招生计划吗？,平行志愿省份自主招生合格考生提前提档不占用计划。，非平行志愿省份提档线上考生不占用招生计划，线下考生占用计划。
提档,gu***18 (河南),2010-05-11 15:44,自主招生已被贵校录取，可加上20分提档。如加上20分后考生成绩还低于当地录取一本线，贵校是否还给予提档。,加上20分后未达到提档线不予提档录取
咨询,ma***g (山西),2010-05-11 15:35,请问：贵校2010年在山西省理科的招生名额有多少？超过山西省2010年一本录取线多少可以报贵校？,1.http://zsb.hit.edu.cn/studentnews/user/newplan.asp?kprovince=山西，2.请参照历年录取分数报考，http://zsb.hit.edu.cn/studentnews/user/score.asp?kprovince=山西
"老师您好:新疆理科考生,请问贵校英才班在新疆招生吗?谢谢",yh***8 (新疆),2010-05-11 15:33,英才班在新疆是否招生,英才班在新疆招收1人
咨询,88*** (山东),2010-05-11 15:26,只能是么优惠？,这一项是备注信息，达到招生计划数1：1调档线加20分安排专业
法语生报考,cl*** (天津),2010-05-11 15:13,作为天津的小语种生，可以报考贵校的什么专业？去年的录取线又是什么,我校今年在天津没有小语种（俄语、日语）招生计划，http://61.167.60.52/studentnews/user/newplan.asp?kprovince=天津
山东：材料科学与工程专业录取分数？培养方向？,45*** (山东),2010-05-11 14:46,材料科学与工程专业录取分数？培养方向？,"山东材料科学与工程理工最低分数656，，，，材料科学与工程专业·(咨询电话：045186413921，045186413821，045186281104)，--------------------------------------------------------------------------------，，该专业培养从事材料设计、研制、组织性能分析与控制以及材料在各领域应用等方面的科学研究、生产开发及经营管理方面的高级专业人才。主要研究方向包括金属基复合材料、金属功能材料、特种合金、表面工程、先进结构陶瓷材料、功能陶瓷材料、聚合物基复合材料、材料的空间环境效应与模拟原理及技术、材料环境效应损伤机制与性能退化及表征、材料环境效应损伤防护技术等。，，本科生有近50%保送或考取硕士研究生。毕业生可面向科研机构、公司或企业，从事新材料研究、开发、科研管理等方面的工作。，，该专业具有硕士、博士学位授予权，为国家培养了大批高水平硕士、博士及博士后。该专业学生有机会赴英国伦敦大学皇后玛丽学院进行""哈工大-英国伦敦大学本硕联合培养""，毕业后，将同时获得哈工大学士学位和伦敦大学硕士学位，同时还有机会通过导师推荐赴国外著名大学攻读硕士和博士学位"
英才实验班 滚动,li***i (山西),2010-05-11 14:37,贵校英才实验板是否实行滚动分流制度？若高考没有进去以后还有机会么？,英才班目前没有滚动分流制度如果成绩好可以保送我校硕士或博士研究生
咨询,88*** (山东),2010-05-11 14:22,自主招生入取名单公式中，有一栏中注明只能、达到什么意思，都是哪些优惠,请把原文地址发给我
英才实验班分数线,li***i (山西),2010-05-11 14:12,贵校7个工科英才班15个名额都是针对一个学院招生，但是理科英才班是针对一个专业招生。所以理科的英才班是否分数会略低一点呢？,英才班分数一般在清华北大分数线下10分以内
咨询,88*** (山东),2010-05-11 14:08,自主招生中能够、达到是什么意思，高考入取中有么政策？,请把问题说完整谢谢
二志愿,tj*** (河北),2010-05-11 14:06,贵校是否在天津招预留二志愿考生？在哈尔滨校区招天津考生的优势专业是什么？就业方向和形势如何？,"1.我校将用该省招生计划的90％录取一志愿考生，用该省招生计划的10％录取二志愿考生，2.参照我校国家级重点学科，，在新一轮国家重点学科评估中，哈工大9个学科喜获一级学科国家重点学科称号，在全国高校中名列第5，其中，工科一级重点学科在全国高校中名列第2。这9个一级学科分别是：力学、机械工程、仪器科学与技术、材料科学与工程、动力工程及工程热物理、控制科学与工程、计算机科学与技术、土木工程、管理科学与工程。这9个一级学科国家重点学科共覆盖了34个二级学科。此外，哈工大的光学、电机与电器、物理电子学、通信与信息系统、飞行器设计、环境工程6个学科被评为二级学科国家重点学科，目前,哈工大国家重点学科的覆盖面达到了40个二级学科。，3.http://zsb.hit.edu.cn/subindex/studentnews/jiuyeqingkuang.asp"
sdwhy,sd*** (山东),2010-05-11 13:48,你好：去年理科最低录取分多少？,640
美术类,ji***2 (黑龙江),2010-05-11 13:36,招美术类考生么？本省,哈尔滨工业大学的艺术设计专业招收艺术类考生。黑龙江省考生参加美术类省统考，我校不组织校考，统考成绩达到我校在黑龙江省所在的录取批次线，我校按高考文化课成绩从高分到低分录取，且外语成绩不低于80分。
咨询,li***o (新疆),2010-05-11 13:25,"老师您好：理科生,想报读贵校，但近视大于800度，很多专业受限，不知还有报读贵校的可能吗？如果有对视力要求低点的专业可报，请您明确提供一下能报读的大类专业，非常感谢。您的回答会让我们很受用。新疆考生家长",裸眼视力任何一眼低于5.0者，不能录取的专业：飞行技术、航海技术、消防工程、刑事科学技术、侦察。专科专业：海洋船舶驾驶及与以上专业相同或相近专业(如民航空中交通管制)。，屈光不正（近视眼或远视眼，下同）任何一眼矫正到4.8镜片度数大于400度的，不宜就读海洋技术、海洋科学、测控技术与仪器、核工程与核技术、生物医学工程、服装设计与工程、飞行器制造工程。专科专业：与以上相同或相近专业。，任何一眼矫正到4.8镜片度数大于800度的，不宜就读地矿类、水利类、土建类、动物生产类、水产类、材料类、能源动力类、化工与制药类、武器类、农业工程类、林业工程类、植物生产类、森林资源类、环境生态类、医学类、心理学类、环境与安全类、环境科学类、电子信息科学类、材料科学类、地质学类、大气科学类及地理科学、测绘工程、交通工程、交通运输、油气储运工程、船舶与海洋工程、生物工程、草业科学、动物医学各专业。专科专业：与以上相同或相近专业。，一眼失明另一眼矫正到4.8镜片度数大于400度的，不宜就读工学、农学、医学、法学各专业及应用物理学、应用化学、生物技术、地质学、生态学、环境科学、海洋科学、海洋技术、生物科学、应用心理学等专业。
咨询,li***o (新疆),2010-05-11 13:24,新建考生过一本线100分，近视850度，报航空航天类专业录取可能性大吗,1.请参照历年录取分数报考http://zsb.hit.edu.cn/studentnews/user/score.asp?kprovince=新疆，，2.参照普通高等学校招生体检工作指导意见，http://zsb.hit.edu.cn/subindex/studentnews/zszhengce5.asp
